{
  "version": 2,
  "request_id": "10000000-0000-4000-8000-00000000000a",
  "context": {
    "user_id": "20000000-0000-4000-8000-00000000000b",
    "device_id": "30000000-0000-4000-8000-00000000000c",
    "tool_session_id": "40000000-0000-4000-8000-00000000000d",
    "device_session_id": "50000000-0000-4000-8000-00000000000e",
    "node_id": "60000000-0000-4000-8000-00000000000f",
    "platform": "macos",
    "generation": 3,
    "monotonic_sequence": 8,
    "current_state_generation": 0,
    "current_screenshot_generation": 0,
    "base_state_id": null
  },
  "lease_until": "2030-01-01T00:00:00Z",
  "observation": {
    "mode": "ax_full",
    "max_nodes": 800,
    "max_depth": 20,
    "max_text_per_node": 160,
    "max_total_text_bytes": 16384,
    "max_visible_rows_per_container": 20,
    "settle": "none",
    "settle_timeout_ms": 0,
    "image_profile": "none",
    "region": null
  },
  "action": {
    "type": "observe",
    "application": "com.google.Chrome"
  }
}
